title,content,rating,version,votecount,votesum,time,page
可不可以恢复我的账号啊！！！！！！！！,为什么我的账号直接被注销了？不是有七天缓冲期的吗！！！！我还没和朋友说再见啊！！怎么办啊！！！！！,1,4.20.0,0,0,2022-03-05T10:54:42-07:00,1
垃圾软件，几年了还这么不稳定,到处是bug，不管是视频，还是语音，没有不出bug的地方，不管你是外放还是用耳机，全部容易有回声，网络明明没问题，非要显示自己或者对方网络不佳,1,4.20.0,0,0,2022-03-05T10:14:28-07:00,1
环境恶劣,官方能不能设置一个考题，只有完成考题才可以注册聊天，挺好的一个交友软件环境太差了，很影响心情，半夜气的我睡不着觉。,1,4.20.0,0,0,2022-03-05T08:59:41-07:00,1
不推荐,平平无奇的找不到，匹配到了聊不下去，然后每天后台挂着还费很多电，垃圾。。。,1,4.20.0,0,0,2022-03-05T06:10:10-07:00,1
不值得玩,我也是老用户了，看了太多喷子了，这个软件应该叫怼怼。这些人没事就评论一些诋毁你的话，有抑郁症去看医生好吗？这个社交软件的用户真的不咋滴，玩了能气死。劝你别上手,1,4.20.0,0,0,2022-03-05T04:51:13-07:00,1
不保护女性玩家,女性玩家在此app内不被保护，女性玩家在狼人杀功能房间没事当众被骂**女，却把女生号封了不封男的号。不分黑白的软件？,1,4.20.0,0,0,2022-03-05T03:39:32-07:00,1
#懂得都懂,玩了这么久，其他的没什么变化，充值商品到是多了不少，莫名禁言封号也是无语了，一个社交软件给用户带来的体验应该是有趣而充满期待的，一昧的圈钱，而不懂得怎么样去留住用户，用户的反馈也得不到及时合理的解决，实在是让人失望,1,4.20.0,0,0,2022-03-05T00:51:38-07:00,1
不管有没有违规举报就封号,这个APP真的不能再垃圾了，没有好人不说还有在这上面卖的这都没事 我也很想知道官方一天在管理些什么 坏人没整治 好人都报废,1,4.20.0,0,0,2022-03-05T00:23:25-07:00,1
编辑瞬间,怎么没有编辑已发送瞬间的功能！,4,4.20.0,0,0,2022-03-05T00:16:23-07:00,1
广告我服了！,开发人员脑子想的什么东西？开屏广告就算了，我没点就自己转到对应的app还直接给我打开了？恰烂钱？,1,4.20.0,0,0,2022-03-04T23:03:45-07:00,1
恶心的软件,如上！再下载我不得好死！,1,4.20.0,0,0,2022-03-04T16:26:51-07:00,1
垃圾,太垃圾了，作为一个社交软件语音经常掉线，知道为什么最后落地到微信了吧？,1,4.20.0,0,0,2022-03-04T09:57:05-07:00,1
【救命】不要给听爵士的人推荐听民谣的,"若一人标签为爵士乐，另一人标签为民谣。麻烦不要推荐给我，真的当头一棒，不是鄙视，是我真的无法喜欢民谣。这样，再多的匹配都是令我更加反感。
来自一个感性的女生的想法，望采纳。",2,4.20.0,0,0,2022-03-04T06:44:32-07:00,1
好软件 伴一生,里面都是充值页面 这就算了 网络暴力 现在卸载了 还天天发短信让下载,5,4.20.0,0,0,2022-03-03T21:43:00-07:00,1
无故封号,我真的没有不当言论，直接被强制掉线，然后强制封号,1,4.20.0,0,0,2022-03-03T19:08:11-07:00,1
下载不了？,下载还要钱？,1,4.20.0,0,0,2022-03-03T13:22:32-07:00,1
提议修整,没有超级可可爱爱的表情，有趣的人太少了,1,4.20.0,0,0,2022-03-03T05:22:43-07:00,1
一般般,啥都要钱，里面都是炫这炫那的、不知道的还以为以为我下载了个懂车app,1,4.20.0,0,0,2022-03-02T23:46:00-07:00,1
普信男不多，说着别人普信男的普信女多去了,哪来的自信？长得一般P图美颜照骗直接10分，结果奔现还是一个职校的家里农村的，出于礼貌见面请她去必胜客，她给我来一句我可以打8分...我差点笑出声...还说自己家里复式别墅二层...农村不都是那种二层的...生怕别人看不起... 这位姐姐语出惊人...我都不想多说了...奔现6次 其中四次翻车在soul 两次在赫兹 我只想说自己家里条件一般 长的也一般在社交软件上哪来的底气在这 嫌这嫌那的？,1,4.20.0,0,0,2022-03-02T22:05:24-07:00,1
音效不能自己设置？,"能不能自己设置匹配的音乐开关？
我一点都不喜欢灵魂匹配的时候放的音乐
明明放的很小声
麻烦加个开关吧！
匹配的时候不需要声音音乐",1,4.20.0,0,0,2022-03-02T18:00:40-07:00,1
垃圾,动不动就封号，垃圾,1,4.20.0,0,0,2022-03-02T16:02:25-07:00,1
咱说的能不能把语音这个功能优化一下吗？,做个iOS系统语音能功能能不能好好整整？切后台之后看其他软件视频，直接掉线。要不然就卡死，能不能优化一下？？？,1,4.20.0,0,0,2022-03-02T11:49:37-07:00,1
语音匹配的蝻人都是精虫上脑吗？,晚上碰到的普信男 一上来就问人家鹿吗？有病吧！举报也没有反馈，净出些恶心人的新玩法！funny mom de pee,1,4.20.0,0,0,2022-03-02T09:50:35-07:00,1
垃圾,什么垃圾软件 我玩个狼人杀 我没骂人在那里说我骂人举报我 我真的是无语了,1,4.20.0,0,0,2022-03-02T07:40:58-07:00,1
不会玩的小哥哥小姐姐,建议不会玩的不要玩，不然会恶心到，我现在就注销了,3,4.20.0,0,0,2022-03-02T01:37:45-07:00,1
差劲👎,"玩了一千多天也见不到几个新人
这几百万用户都是花钱买来的吧
发个瞬间没人看的
跟个单机游戏似的
我还不如写在日记本或者备忘录上
最垃圾的软件之一",1,4.20.0,0,0,2022-03-02T00:48:17-07:00,1
太差劲  对于随便辱骂的不给予处理,这个软件太垃圾 对于随便辱骂的不给予解决处理  到底这个软件管不管随便骂人攻击人的 请问 举报了给个处理结果,1,4.20.0,0,0,2022-03-02T00:26:07-07:00,1
差评,乱七八糟的人 身份都是假的 还有诈骗的 骗子在里面 你们都不管 举报都不管 破软件,1,4.20.0,0,0,2022-03-01T22:37:24-07:00,1
差评,乱七八糟的人 身份都是假的 还有诈骗的 骗子在里面 你们都不管 举报都不管 破软件,1,4.20.0,0,0,2022-03-01T22:37:24-07:00,2
语音聊天不加速匹配不到人,不充钱 不能聊天是吧,1,4.20.0,0,0,2022-03-01T21:36:02-07:00,2
垃圾,垃圾软件，卸载了还不停发信息,1,4.20.0,0,0,2022-03-01T20:22:27-07:00,2
我只能说身份证被注册过后申诉一直没结果,身份证被盗用申诉四五回没结果,1,4.20.0,0,0,2022-03-01T12:56:21-07:00,2
不是原来的soul了,语音想找人说说话吧 只能接通第一个 不用加速卡就永远都匹配不到 强制消费呗,1,4.20.0,0,0,2022-03-01T09:04:30-07:00,2
胡乱封号,垃圾APP，胡乱封号，沟通渠道又少，非要到一些平台投诉才沟通，但也不算沟通，顶多也就通知一下原因，都跟他们说明情况了还永久封，听不懂人话，不珍惜用户是吧，卸载！！！继续投诉到工信部去,1,4.20.0,0,0,2022-03-01T08:51:04-07:00,2
迟早凉凉,什么p软件，随便封号，我一个一千多天的人了，就刚刚莫名其妙一个抽烟喝酒纹身女被渣男玩了，来找我骂我冲我发脾气，关我什么事，我拉黑了还封我号，笑死,1,4.20.0,0,0,2022-03-01T08:41:26-07:00,2
搞黄色的男的太多了！,搞黄色的男的骚扰我 我举报。Soul把我也封了，笑死 傻杯软件,1,4.20.0,0,0,2022-03-01T07:36:07-07:00,2
语音通话,聊天没问题但是语音次数能不能增加,5,4.20.0,0,0,2022-02-28T15:25:06-07:00,2
有趣的灵魂,在业余的时间充实一下也是不错的晚上地铁跑酷啊放松一下心情建议大家载这个游戏说是真心不错的，外面高清内容充实然后角色有挺多这游戏还是有禹庙兰亭今古路特的魅力的特别是各式各样的车子收集起来特别过瘾谁让我喜欢车呢希望这游戏能越做越好期待更多更靓的车子出现同步竞技特别刺激有趣味如果社交能支持微信朋友一起交流相信这游戏能有更多的朋友来一起参与最后希望这游戏能有更多有趣的活动祝我自己心愿能够实现家人身体健康心情愉快为什么我再重新下载之后云端保存的数据有任何显示只给我留下了云端数据的代币代币车和卡片我辛辛苦苦手刷的数据一点都不保存然后就是单机重刷了段时间之后显示了云端和本地数我们可以尝试一下这款游戏真的是非常的不错比我玩我其他的都好玩太多了真是特别特别的厉害怎么早上中午晚上组合挺自由挺练习和分享或者乐早上中午晚上组合挺自由挺练习和分享或者乐只新的成长体积店名功能开放共享你的精彩点多家出来露露更多哟质口袋服务等你将吃遍天下而且从一代开始玩就等于这个版本的完全打不过下个版本组给我种不就别想继续玩的感觉要知道王已经出了好多了预约奖励之类的跟没有一样除了钻石能开包之外其他都是养成玩法实在太肝到了一定等级才会解锁某张而且想要的不在一个身上也就是需要肝数个才行我这一星就是给王这个名字的特色金系统多奖励减半是大家都知道的如果就这一家有这也就忍了但还有际服这个竞争对手服一的优势就是好所以王不要再走提前圈猪老路了王这非常有潜力的如果这你都能经营黄了那你可真厉害了想提点小建议中的不用让你比际服高差不多就行这样亲民点才能大量引流际服和萌新基数多了你害怕赚不到吗你这点可以学学的者人家可以一分不花为什么赚这么多就是基数大一人元也比你这扣等土豪金强服王越来越好不要变成短命。用心做特用脚做什么规则什么故事情节统统舍弃你这样还不如自己开发独立呢!有谁见过场上只能放张片的吗哦,5,4.20.0,1,0,2022-02-28T14:00:58-07:00,2
真垃圾,垃圾软件，视频人都匹配不到,1,4.20.0,0,0,2022-02-28T09:18:26-07:00,2
抗议抗议,作为一个1500天老用户，都不分配个女朋友😡,5,4.20.0,0,0,2022-02-28T08:30:08-07:00,2
非常垃圾,员工非常垃圾，明明没有违规判定别人违规，别人申诉了几次就直接封号半个月没有任何理由就是看审核员的心情来的迟早玩完,1,4.20.0,0,0,2022-02-28T07:32:51-07:00,2
很不喜欢,这个软件里的男的都是些什么🐶东西  好恶心  刚加就问谈不谈恋爱😅  还差点毁了一个家庭  真下头男  都是些剩男来这里找对象的  都是些3 40岁的人😅,1,4.20.0,0,0,2022-02-28T04:33:21-07:00,2
谢谢,孤独的时候有人能陪着说说话里面的有些人真的很好很感谢这个软件,5,4.20.0,1,1,2022-02-28T03:41:44-07:00,2
垃圾,很垃圾 刚玩5分钟就被封号了,1,4.20.0,0,0,2022-02-28T03:15:12-07:00,2
一个举报就会封号就很烦,soul应该改一改一个举报就会封号这个规则，好多人恶意举报！！！,3,4.20.0,0,0,2022-02-27T22:39:52-07:00,2
用soul1000多天了，这次真的要给差评！,就连“小而美”的微信，恶心如腾讯，都可以照片选择“选中的照片”或者弹选择更多来添加照片，自定义app允许访问的照片了，你们Soul为什么还不支持？还让我自己跑设置添加？？？非让我开所有照片好让我泄密？你们就是这样保障用户隐私？？？？,1,4.19.0,0,0,2022-02-27T11:20:58-07:00,2
无语,虽然我才在这几十天（还没天天上线）遇到的一部分男的真的很恶心上来打招呼出于礼貌回了回了之后就各种黄色咱们就大无语然后去发了个帖说这件事就好多男的都来攻击……而且也有很多给soul做广告啊做的那么好来了才发现……（治治黄色话题吧）,1,4.19.0,0,0,2022-02-27T09:21:35-07:00,2
垃圾软件,垃圾的很，又恶心，骗钱,1,4.19.0,1,0,2022-02-27T07:39:21-07:00,2
不错 真的,真的,5,4.19.0,0,0,2022-02-27T04:24:15-07:00,2
晚上尤其是11点以后如果点匹配会收到非常多的骚扰,11点多以后点匹配大部分打完招呼会说很淫秽的话，引起很强的不适，还有和我吹嘘今晚面基其他小姐姐发骚哪些黄色细节的，实在太恶心就退了,2,4.19.0,0,0,2022-02-26T17:54:17-07:00,2
差评,莫名其妙禁言我，原因也不说，具体是那句话还是哪个字，就说我违规了。2020年注册至今没说过半句脏话。,1,4.19.0,0,0,2022-02-26T08:45:28-07:00,2
问题太多,就想知道为什么  语音匹配举报过的  还能再给我匹配在一起？？？ 而且经常发生     还有为什么女的就有15次  男生只有五次   搞赤裸裸的性别歧视真的好吗？,1,4.19.0,1,0,2022-02-26T03:18:16-07:00,2
为啥我下载还要付款,之前下载过，后来卸载了，现在下载回来就提示要付款,1,4.19.0,1,0,2022-02-26T03:11:46-07:00,2
垃圾软件，体验好差,已卸载,1,4.19.0,1,0,2022-02-26T00:59:39-07:00,2
垃圾软件,真的，社交软件里最垃圾的了。动不动干嘛都收费。啥也不干对方聊天有问题也封号。 史上当之无愧的割韭菜软件。 不应该叫soul 应该叫 嗨 韭菜。,1,4.19.0,1,0,2022-02-26T00:36:43-07:00,2
超完美的软件,来两个多月了就认识一个聊得来的，其实觉得这个软件挺好的，可以不用来社交，可以用来发泄一下自己的小情绪，反正你不认识我我也不认识你，赞,5,4.19.0,2,2,2022-02-25T23:52:46-07:00,2
学次恋爱,不错的软件，无聊的时候还能跟陌生朋友聊聊天，打发时间,5,4.19.0,1,1,2022-02-25T23:51:50-07:00,2
自由的空间,"我对soul的理解就是，怎么自在怎么玩，能交朋友的方式很多，别刻意维持人设，社交软件不就图一乐吗？
之前看soul的短片中，有这样一句话。“现在的年轻人，越来越不喜欢发朋友圈了”，仔细想想我自己也是这样，很久没在朋友圈中分享日常了，一边考虑身边人看到多想，还考虑要不要屏蔽一些人，突如其来的想法被一再删减，最后还不如不发。",5,4.19.0,2,2,2022-02-25T23:35:42-07:00,3
无语,下载两次 都进不去 说是什么我未成年已经实名 无法登陆 你倒是给我一个地方让我换号登陆啊？印象最差的垃圾软件,1,4.19.0,0,0,2022-02-25T06:37:34-07:00,3
请问恶意举报也能被封号吗,我是真的没有违规，为什么还有恶意举报呢？难道说年龄就违规了吗？请赶紧恢复,1,4.19.0,0,0,2022-02-25T05:22:43-07:00,3
恋爱铃,"多给我匹配恋爱铃吧，匹配到的别是学生要上班的
你们这个软件要分类好不好把上班的和上学的学生分开匹配，这样匹配一些都是学生根本没发聊
还有就是为啥近距离的要收费这样不就成为一个用钱买联系方式的软件嘛，希望更改一下三年的用户了",5,4.19.0,0,0,2022-02-25T02:49:27-07:00,3
就这？,不充钱永远匹配不到人,1,4.19.0,1,0,2022-02-24T17:41:42-07:00,3
soul的封号绝绝子,你们长个眼睛就知道封谁了 瞎封 有证据给你们也当看不见666 抖音宣传什么呢 丢人现眼 soul是真的6哥 无语你好久了,1,4.19.0,0,0,2022-02-24T11:39:01-07:00,3
破软件,这个软件真的是害人不浅，让我的未来女朋友心痛心寒！,1,4.19.0,1,0,2022-02-24T02:39:15-07:00,3
.,好多下头男 真无语 骗子 谁下载谁倒霉,1,4.19.0,0,0,2022-02-23T21:47:25-07:00,3
恶心,"两次莫名其妙封禁我   
我甚至都没有和别人聊天",1,4.19.0,0,0,2022-02-23T21:30:34-07:00,3
几年的老用户，玩吐了要！！！,明明几句简短的聊天话语，随随便便就封人，矫枉过正了好吗？一句确系违规，一点证据都没有，我保证我没说过露骨的话，你知道随意封人会给玩家的形象造成多恶劣的影响吗？你好歹拿出点证据，封人封的心服口服好吗？你们的审核人员都是吃shi的吗？,1,4.19.0,1,1,2022-02-23T19:23:26-07:00,3
骗人的,这款软件我用了一千多天了，没有一个人和我聊过天，打招呼就石沉大海，马上快两千天了，从来没有和女的聊过天,1,4.19.0,1,0,2022-02-23T19:09:38-07:00,3
老有人登陆我账号,每个月都有人试图登我账号，我都点注销了还没有成功，好无语，今天有有短信发过来,1,4.19.0,0,0,2022-02-23T17:11:34-07:00,3
漏！,验证码明明对的非得说是错的，输了好几遍直接不让我登录了？救命啊我真服气了,1,4.19.0,0,0,2022-02-23T15:58:29-07:00,3
无故封人,7月开始准备考研，卸载至今，下载回来就发现账号封禁，不给理由不给封禁时间，让我申诉，请问我连理由都不知道如何申诉。人工客服说有官方通知信息，我账号都无法登陆，请问如何查看通知。大天才设计的封禁申诉流程，这边建议换岗呢。,1,4.19.0,0,0,2022-02-23T13:03:09-07:00,3
关于禁言,我真的很无语，明明是不认识的人来自己的评论区底下侮辱我和我开黄腔，我私聊骂回去了，为什么只封我还封了两次，真的很失望,1,4.19.0,0,0,2022-02-23T09:24:56-07:00,3
男女差别真的好大，能留下的都是真的是神奇人了,"注册时间也不短了，断断续续，三年多了，怎么变成这样了。动不动就封号，根本就不看内容，反正就是封号。刚开始的时候，申诉很快，现在要等一个工作日。
再见了",1,4.19.0,0,0,2022-02-23T08:24:02-07:00,3
气不过来评论了,"1300+老用户 因为在私聊被别人平白无故骂了一句 我回骂一句 被举报以后封号了 找客服没有解决结果 
已经卸载三个月了 这辈子不会再用 呵呵",1,4.19.0,0,0,2022-02-23T06:02:52-07:00,3
登陆问题,很久以前我就用QQ登陆的，超，弄着弄着换了个手机再登陆的时候就没有QQ界面了真的神奇，官方还得是你们6666,1,4.19.0,0,0,2022-02-23T05:26:40-07:00,3
太差劲啦,正常聊天都限制。干脆不让人聊天好了。鸡肋产品。,1,4.19.0,0,0,2022-02-23T02:11:17-07:00,3
骚扰言语审核问题,"朋友们，如果你是妹子，你要小心用这个软件，如下：因为当你遇到言语骚扰时（当然社交app嘛，我们都有这个心理准备），你是不能反击的，只能一键举报等待不知何时对才能被处理。 而你反击了，非常不好意思，你就要被封号了，是不是很有意思？
这个心理准备我着实没有。希望玩这个软件的你们有。",2,4.19.0,0,0,2022-02-22T23:04:45-07:00,3
垃圾软件，什么时候倒闭,无缘无故封禁我的账号几个小时，说什么我不文明发言，我服了，我就早上发了个瞬间分享了一个最近天气，我都没私聊，昨天我都没上线过。你封我账号可以，给我一个合格的理由啊，你说我不文明发言，我TM都没说话，就分享了一个天气。分享天气是不文明发言？,1,4.19.0,0,0,2022-02-22T21:38:30-07:00,3
应该是性骚扰下头男同谋,举报不处理 抨击下头男的瞬间真实却在审核哦 哇 好恶心,1,4.19.0,0,0,2022-02-22T12:10:05-07:00,3
根本没有保障用户权益的软件,作为一个交友聊天软件，都是遵守社区规范交流聊天，可是软件管理就跟小孩子过家家一样随随便便就封用户号，而且我也是好几年的用户了，聊天聊着聊着就好好被封号，啥也没说也封号，说了玩笑话也封号，这样软件还可以存活玩下去，而且后台也没有证据出来，最关键没有证据说封就封，无处可找公平申诉，吐槽,1,4.19.0,0,0,2022-02-22T07:40:08-07:00,4
被误封号,莫名其妙的就被封号了通过各种途径找回一点软用没有,1,4.19.0,0,0,2022-02-22T06:57:07-07:00,4
体验极差，里面的人鱼龙混杂良莠不齐。这个app的性质已经变了很久了,体验极差，里面的人鱼龙混杂良莠不齐。这个app的性质已经变了很久了,1,4.19.0,0,0,2022-02-22T06:12:34-07:00,4
无语死了,第一天登上就遇到ghs的便太，和他斗智斗勇被举报了自己号被封了…..申诉了也没用…..soul真的有不瞎的人工吗……真的好垃圾,1,4.19.0,0,0,2022-02-22T05:23:13-07:00,4
Bug,破软件，我昨晚卸载的，为何有人说我今天还在线，软件都没，怎么提示在线，软件Bug吗？,1,4.19.0,0,0,2022-02-22T01:42:34-07:00,4
无缘无故封号,真的垃圾,1,4.19.0,0,0,2022-02-22T00:02:53-07:00,4
..,"真垃圾  匹配次数不多 有的还要给人送礼物  
好不容易次数多了。还要吞次数 没匹配 次数自动就变没了。垃圾软件 无效社交 不建议",1,4.19.0,0,0,2022-02-21T23:28:12-07:00,4
无效社交软件,无趣的要死，堂堂一个社交app连个有趣的人都找不到，正经年轻人谁玩这个,1,4.19.0,0,0,2022-02-21T19:04:36-07:00,4
手机号码停用 账号换绑都登不上,soul真的太鸡肋了，用户手机号码停用，结果自助换绑时要求填写密码，明明注册是用验证码登陆，哪来的密码！后面身份证校验，都还是无法校验，总之当初注册时没设置密码和手机号码停用的，别想要回自己的号了！,1,4.19.0,0,0,2022-02-21T19:04:12-07:00,4
笑了,很恶心，为了钱不择手段,1,4.19.0,0,0,2022-02-21T19:01:41-07:00,4
账号被盗,账号被盗，现在根本弄不回来，举办，找客服根本没用，垃圾软件，真的气人,1,4.19.0,0,0,2022-02-21T18:17:53-07:00,4
能不能用点心？,玩soul两年了，一直都挺喜欢这个软件的，也从未有过违规现象，但却无缘无故的就登不上去了，提示我账号异常，我想问：为什么？凭什么？ 关键是一但异常申诉都没法申诉。对这一点特别不满意，希望能好好改进一下,1,4.18.0,0,0,2022-02-21T17:23:02-07:00,4
没什么太大作用,看了很多广场发的 下面评论很多但一个回复没有我想说几百条评论你一个看不上？怀疑是机器人。但是点进主页好像又挺正常的 后来坚持评论 基本上还是没人回 回了也是答非所问 毫无交流体验 最新板块以前挺好的 现在也没了 基本上是自言自语 和看照片 社交软件搞得让人更孤独了有没有 还不如加个qq群在里面其乐融融一帮人聊天,1,4.18.0,0,0,2022-02-21T15:29:51-07:00,4
真是很垃圾。的软件,我是真的没用过这么垃圾的交友软件，虚假信息太多，我不知道做这个软件的目的是什么，无效交友，无效交友，浪费时间，一帮睿智才会玩的玩意,1,4.18.0,0,0,2022-02-21T12:24:57-07:00,4
用户体验丝,丝毫没有，并且还把我号封了，没有客服电话手动反馈不能解封，还有的女的莫名其妙的骂人素质极其低下,1,4.18.0,0,0,2022-02-21T08:41:38-07:00,4
对男性的偏见,"为什么语音次数 女的10次以上  男的就3次？ 体验点赞都不加次数了！
有时候女性秒挂 我就浪费一次语音次数
打完还要交钱 增加次数 怎么？就这么看不起男性吗？
动不动让男性 不合理消费！
体验感 非常差！",1,4.18.0,0,0,2022-02-21T07:24:14-07:00,4
真恶心人,私聊都要充钱？资本家脸都不要了？,1,4.18.0,0,0,2022-02-21T04:46:33-07:00,4
三四年的老用户送我说一句垃圾不过分吧？,上面什么牛鬼蛇神都有，别人各种擦边盗图你不管，这下好了，我随便发个风景照啊美食啊都给我限流，哈？至于为什么还在呢，因为还算是一个比较隐私的平台，没有人认识，吐吐槽。 总之越来越垃圾了。,1,4.18.0,0,0,2022-02-20T23:50:47-07:00,4
看看吧,这个软件真的太拉了，连注销个账号验证码都一直注销不了,1,4.18.0,0,0,2022-02-20T22:29:22-07:00,4
soul是你最终的归宿,"脱单找soul 玩游戏找soul 交友找soul 团建找soul 

 soul无所不能 过了哈哈 主要还是社交活动",5,4.18.0,1,1,2022-02-20T22:13:23-07:00,4
老是发短信给我手机里,我都注销卸载了 还老是发短信手机里又不能直接退订信息很烦天天发,1,4.18.0,0,0,2022-02-20T20:08:58-07:00,4
垃圾，想尽办法让提供身份证,三天两天禁言，封号。垃圾软件。,1,4.18.0,0,0,2022-02-20T19:40:56-07:00,4
无缘无故封号，我就弄不懂了，倒闭算了,无缘无故封号，我就弄不懂了，倒闭算了,1,4.18.0,0,0,2022-02-20T17:37:25-07:00,4
1500多天的老用户，真无语了,"1.关于语音匹配，男生看似次数也不少，但是实际上根本匹配不到人，只能充值加速才可以，那么多次数都是无效的的
2.关于违规举报，我专门看了，你们说的每一天违规举报都是人工审核，为什么对男性这么恶意大呢，根本不查就无故说违规立马禁止一些功能，我立马申诉却要等至少一个工作日，既然是人工审核，可以看到聊天内容的话，那拿出证据来啊，无故被举报真的审核了么，真是恶心人
3.另外举报了别人涉嫌诈骗，举报信息中附带公安局局受理的案源号等信息，到现在有没有任何举报反馈，失望透顶
4.甭管是语音匹配还是其他匹配，男女的次数可能不一样，但是有效次数太少了吧，男的就是指望着充值才行，是吧？还有广场里的帖子都是啥质量啊，只要是个女的随便发个段子也好照片也好，那么多点赞评论，真是恶心，还非给你推送这些没有任何质量内容就是博一关注的帖子
5.槽点太多了，终究是网络，真是让用了这么多天的老用户恶心，知道你们现在做大了，不在乎了无所谓了，那你们继续，我是卸载了",1,4.18.0,24,5,2022-02-20T16:21:01-07:00,4
soul,不开心就去soul，在soul，没有人知道你的身份，在soul 没有标签，没有熟人，在soul 尽情的释放自己，在soul 遇见懂你的人,5,4.18.0,2,2,2022-02-19T17:06:05-07:00,4
