title,content,rating,version,votecount,votesum,time,page
异常,匹配就服务异常，语音通话3次两次匹配不上人，要不然就胖匹配一次算了，怎么回事？过年了放假了？都不管了是吗,3,4.18.0,0,0,2022-02-04T09:19:03-07:00,9
异常,匹配出现服务异常,1,4.18.0,0,0,2022-02-04T08:56:47-07:00,9
最后一次吐槽,"1300多天老用户了吧，只从一年前再下回来，吞瞬间的事情屡见不鲜，我怀念一下长辈不能让别人看见?匹配五个就匹配过快，不让匹配，还弹窗让我评价，耗子舔猫*，没事找刺激?

找对象，在这软件就算了吧，恋爱观早就扭曲了，当个树洞得了。",3,4.18.0,0,0,2022-02-04T08:16:08-07:00,9
就是要你充钱！,语音匹配，不用加速卡，永远都匹配不到，现在做大了，厉害了！,1,4.18.0,0,0,2022-02-04T05:40:52-07:00,9
卸载不了.,卸载不了,1,4.18.0,0,0,2022-02-04T03:22:05-07:00,9
无语,就无语 我为啥不能发动态啊！！并没有被封号或禁言之类的！！！发了 只有自己能看到 别人看不见！！！气死我,1,4.18.0,0,0,2022-02-03T18:21:50-07:00,9
已注销真是太恶心了,什么软件啊？连个人都没有 就知道发一些动态 搁那钓鱼 全是变态,1,4.18.0,0,0,2022-02-03T17:45:48-07:00,9
体验极差,体验感极差，举报骂人的还被封号，也不知道这软件谁开发的,1,4.18.0,0,0,2022-02-03T17:42:33-07:00,9
无缘无故被封了,之前玩了几个月的soul，认识了一个人，加了微信，最近不小心把他删了，想回soul重新看一下号码，然后给封号了，也看不成了（骂骂咧咧）,1,4.18.0,0,0,2022-02-03T09:15:59-07:00,9
给程序员发点工资吧,哎   我就无语了 以前的soul还能切换账号   现在的刚下回来直接就登到以前的号了   以前的那个号未成年   因为那个的实名认证上面的身份证是不对的 我已经成年了   我想重新换个号吧  直接青年模式把我强退了   我不理解   我想换个号不行吗  我直接无语  刚下回来直接就登到我以前那个号去了  还换不了了   我直接无语,1,4.18.0,0,0,2022-02-03T06:27:32-07:00,9
莫名其妙封禁 申诉形同虚设,傻宝软件两个号都给我莫名其妙封了 举报两个性骚扰 麦p的 结果他们没事给我封了。理由都不给我一个 去申诉消息石沉大海 打人工一直都是机器人敷衍你 给广告投放的钱拿出来点给员工吧 吃干饭的东西 一星都不想给,1,4.18.0,0,0,2022-02-03T02:01:36-07:00,9
满屏的段子手和机器人吸粉,广场上到处是段子手和吸粉机器人，太假太恶心，你们如果放任这种情况下去，马上就沦落成第二个陌陌,5,4.18.0,0,0,2022-02-02T19:13:12-07:00,9
引流后的soul真实绝绝子,就不开会员的话瞬间没有曝光量呗，限流呗，你挺会啊soul，老用户越来越心寒,1,4.18.0,0,0,2022-02-02T19:09:46-07:00,9
建议下架,莫名其妙就封号，兄弟们撤了,1,4.18.0,0,0,2022-02-02T17:20:24-07:00,9
垃圾中的战斗机,里面骗子超级多，套路满满的，表达意思根本不是带着污秽的意思，他直接给你封号，最开始封咯一天，我还没上线又来10天，申诉都没用，垃圾,1,4.18.0,0,0,2022-02-02T15:50:44-07:00,10
无语,"就是很离谱啊给别人一个干净的社交环境可以吗？这个软件也是很多人宣传吧？我之前在上面发了几张比较好看的一些照片吧，然后就有一些人在下面说一些污言秽语，在评论下面说我就算了还直接就是带到私信了，一直在跟我说一些不堪入耳的话，不回的话还道德绑架，还有时候爆粗口啊……说什么的话懂得都懂，真的什么人都有，然后也不想多说了
总的来说就是很垃圾很下头的一个软件，完全没有一点用处",1,4.18.0,9,3,2022-02-02T07:39:14-07:00,10
感谢soul给我一个干净的平台,我玩儿soul已经三年多了，一直也就是解解闷，知道2022年1月29日这天，我遇到一个同城的宝藏女孩，1月30日我和她第一次见面，我可能用了我一月所有的好运让我遇到她，甚至在这之前，我觉得一见钟情就只是见色起意的一种狡辩，可当我注视着她的眼睛的那一秒，我的心都融化了，她有着这世间一切的温柔，眼神里洒满了星辰大海，不出意外，我们在一起了。我希望大家始终相信，所爱隔山海，山海皆可平。soul为我们锻造了一个干净的社交平台。我希望大家都能在这个平台上找到属于自己的幸福。,5,4.18.0,0,0,2022-02-02T07:30:04-07:00,10
请求备份聊天记录,什么时候才可以把聊天记录像微信那样备份一下 求求了,1,4.18.0,0,0,2022-02-02T07:04:24-07:00,10
经常崩毁 卸载了还下载不回来,经常崩毁 卸载了还下载不回来,1,4.18.0,0,0,2022-02-02T04:50:12-07:00,10
差评,充值了，也一直匹配不上，反复和客服反馈，也没人管，真心烂,1,4.18.0,0,0,2022-02-02T00:46:43-07:00,10
你们好像穷要饭的,我已经卸载两个月了，动不动就给我发短信整那虚假消息，谁谁谁给你留言了，谁谁谁喜欢你了，我特意下载回来，直接注销，有多远滚多远，真下头，自己不找找问题出在哪，总是用这些方式让人恶心，如果软件做得好，谁会经常卸载，谁会几个月不登陆，不解决问题只知道恶心人，垃圾策划，垃圾软件,1,4.18.0,1,0,2022-02-01T20:04:28-07:00,10
性别歧视,"男的一不小心说了啥就是禁言封号
女的都快脱光了也没事
我点的举报，结果封的是我的账号，女的一点事儿都没有
咱就说soul是不需要男性用户的呗，女性用户是上帝，男的就是小鬼呗",1,4.18.0,0,0,2022-02-01T17:04:46-07:00,10
恋爱铃真的坑,恋爱铃两个月都不带响的。一充钱用加速卡立马匹配到异性！？？,1,4.18.0,0,0,2022-02-01T14:17:06-07:00,10
无语,搞不懂这个软件现在搞成个垃圾软件了，怎么敢各种收费的，每次更新就是想着怎么增加收费项目的，玩了四五年一点点见证soul的堕落，奇怪的用户越来越多了，难怪以前的老用户都不玩了都注销了,1,4.18.0,1,0,2022-02-01T10:21:07-07:00,10
e,感觉越来越没意思 半天匹配不到人,3,4.18.0,0,0,2022-02-01T05:21:26-07:00,10
好评,软件真的不错，感谢这个软件,5,4.18.0,1,1,2022-02-01T01:20:19-07:00,10
没有人聊天,一堆擦边球 以前一堆人聊天现在啥也不是,3,4.18.0,0,0,2022-01-31T23:10:53-07:00,10
带微信就封号,随便说点就瞎封号文字狱，聊天还要送礼物，垃圾玩意卸载了,1,4.18.0,0,0,2022-01-31T20:08:38-07:00,10
垃圾软件性别歧视,没意思 还说什么男女平等？TMD女的匹配次数没有限制 男的就二三十次 语音女的一来就去13次 男的就她们的零头 无语住了 什么垃圾软件还性别歧视,1,4.18.0,0,0,2022-01-31T16:39:31-07:00,10
越来越垃圾,匹配只能成功一次，然后就要钱,1,4.18.0,0,0,2022-01-31T08:29:39-07:00,10
可以把通知好友回来的取消吗,每次重新下载进去看看都有这个，我只是回来看看并不是想聊天，想聊我也会自己匹配的。谢谢,3,4.18.0,0,0,2022-01-31T05:40:23-07:00,10
搜索昵称搜不到人！！！！,我真的要爆哭了，由于之前跟soulmate产生矛盾大吵一架之后我拉黑了他，后续我很长一段时间没有登陆，今天登陆上去发现我被拉黑了，目前我用另一个号注册之后搜索他的用户名却找不到他，而且我搜我原来的账号也搜不到，求产品提供解决方案！！！真的不想因为这样错过！！！,2,4.18.0,0,0,2022-01-31T02:00:22-07:00,10
主要为了上来,真的服了，我当个管理啥也没干被封了，真的服了，说我低俗色情，什么啊我根本没有，然后封了我五天，真的服了，误封还不承认说就是我,5,4.18.0,0,0,2022-01-31T01:34:50-07:00,10
恶臭,里面全是恶臭蝻，随便乱封号，纵容色情骚扰,1,4.18.0,0,0,2022-01-30T21:09:29-07:00,10
垃圾,手机号码都没有注册过，刚刚去注册显示已经给别人注册了，别人注册我的手机号码连验证码都不用吗？真垃圾,1,4.18.0,0,0,2022-01-30T09:10:53-07:00,10
封号禁言问题,上面很多涉黄的话图片没看你们平台处理，我就发了一句“只要你缺钱咱俩就有缘”居然被封号！简直了,1,4.18.0,0,0,2022-01-30T06:14:08-07:00,10
